<?xml version="1.0"?>
<SettingsDesc target="SRSensor" xmlns:xsi="http://www.w3.org/2001/XMLSchema-instance" xsi:schemaLocation="file:// ../../Xml/schemas/SensorSettings.xsd">
  <int default="0" min="0" max="15">channel</int>
  <string pattern="None|LowPassAlpha|LowPassFreq|MovingAvg|Median" default="None">filterA</string>
  <float default="1.0">prmA</float>
  <string pattern="None|LowPassAlpha|LowPassFreq|MovingAvg|Median" default="None">filterB</string>
  <float default="1.0">prmB</float>
  <float default="1.0">k</float>
  <float default="0.0">b</float>
</SettingsDesc>